{
  "businessId": "XAIS12345678910",
  "typeOfBusiness": "self-employment",
  "tradingName": "ABC Ltd.",
  
  "yearOfMigration": "2022",
  "firstAccountingPeriodStartDate": "2019-09-30",
  "firstAccountingPeriodEndDate": "2020-02-29",
  "latencyDetails": {
    "latencyEndDate": "2020-02-27",
    "taxYear1": "2018-19",
    "latencyIndicator1": "A",
    "taxYear2": "2019-20",
    "latencyIndicator2": "A"
  },
  
  "accountingPeriods": [
    {
      "start": "2023-04-06",
      "end": "2024-04-05"
    }
  ],
  
  "quarterlyTypeChoice": {
    "quarterlyPeriodType": "standard",
    "taxYearOfChoice": "2023-24"
  },
  
  "commencementDate": "2023-04-06",
  "cessationDate": "2024-04-05",
  "businessAddressLineOne": "1 Acme Rd.",
  "businessAddressLineTwo": "London",
  "businessAddressLineThree": "Greater London",
  "businessAddressLineFour": "United Kingdom",
  "businessAddressPostcode": "M1 1AG",
  "businessAddressCountryCode": "GB"
}